[
  { "id": "consultants_reference_01", "parentType": "module", "parentId": "consultants_module_01_role_modern_hair_restoration", "citation": "IIOHR Consultant Academy Framework. Role and scope guidance.", "sourceType": "consensus", "year": 2026, "url": "", "notes": "Internal framework reference.", "evidenceTier": "consensus" },
  { "id": "consultants_reference_02", "parentType": "module", "parentId": "consultants_module_02_foundations_hair_scalp_science", "citation": "Clinical trichology foundational teaching materials.", "sourceType": "textbook", "year": 2026, "url": "", "notes": "Foundational educational reference.", "evidenceTier": "B" },
  { "id": "consultants_reference_03", "parentType": "module", "parentId": "consultants_module_03_common_hair_loss_presentations", "citation": "Clinic-facing recognition and escalation teaching notes.", "sourceType": "consensus", "year": 2026, "url": "", "notes": "Use for role-safe presentation literacy.", "evidenceTier": "B" },
  { "id": "consultants_reference_04", "parentType": "module", "parentId": "consultants_module_04_consultation_structure_information_gathering", "citation": "Structured consultation and documentation standards.", "sourceType": "guideline", "year": 2026, "url": "", "notes": "Supports standardised information gathering.", "evidenceTier": "consensus" },
  { "id": "consultants_reference_05", "parentType": "module", "parentId": "consultants_module_05_candidate_screening_suitability_support", "citation": "Candidate screening support and escalation guidance.", "sourceType": "guideline", "year": 2026, "url": "", "notes": "Focus on triage and escalation support.", "evidenceTier": "consensus" },
  { "id": "consultants_reference_06", "parentType": "module", "parentId": "consultants_module_06_ethics_consent_scope_of_practice", "citation": "Ethics, scope, and consent-support governance notes.", "sourceType": "guideline", "year": 2026, "url": "", "notes": "Mandatory safety domain reference.", "evidenceTier": "consensus" },
  { "id": "consultants_reference_07", "parentType": "module", "parentId": "consultants_module_07_communication_excellence_trust_based_consultation", "citation": "Trust-based consultation and patient communication standards.", "sourceType": "consensus", "year": 2026, "url": "", "notes": "Supports communication scenarios.", "evidenceTier": "consensus" },
  { "id": "consultants_reference_08", "parentType": "module", "parentId": "consultants_module_08_non_surgical_treatment_education", "citation": "Non-surgical treatment education boundaries for support staff.", "sourceType": "consensus", "year": 2026, "url": "", "notes": "Scope-safe education reference.", "evidenceTier": "consensus" },
  { "id": "consultants_reference_09", "parentType": "module", "parentId": "consultants_module_09_surgical_education_for_non_doctors", "citation": "Surgical pathway explanation boundaries for non-doctor teams.", "sourceType": "consensus", "year": 2026, "url": "", "notes": "Supports non-doctor surgical education boundaries.", "evidenceTier": "consensus" },
  { "id": "consultants_reference_10", "parentType": "module", "parentId": "consultants_module_10_clinical_photography_documentation_handover", "citation": "Clinical photography and handover documentation standards.", "sourceType": "guideline", "year": 2026, "url": "", "notes": "Template-led documentation reference.", "evidenceTier": "consensus" },
  { "id": "consultants_reference_11", "parentType": "module", "parentId": "consultants_module_11_pre_operative_coordination_preparation", "citation": "Pre-operative coordination and readiness workflow guidance.", "sourceType": "guideline", "year": 2026, "url": "", "notes": "Operational coordination reference.", "evidenceTier": "consensus" },
  { "id": "consultants_reference_12", "parentType": "module", "parentId": "consultants_module_12_post_operative_support_follow_up_escalation", "citation": "Post-operative follow-up and escalation standards.", "sourceType": "guideline", "year": 2026, "url": "", "notes": "Escalation pathway reference.", "evidenceTier": "consensus" },
  { "id": "consultants_reference_13", "parentType": "module", "parentId": "consultants_module_13_difficult_consultations_high_risk_scenarios", "citation": "High-risk consultation handling and ethical escalation guidance.", "sourceType": "guideline", "year": 2026, "url": "", "notes": "Vulnerability and pressure-selling reference.", "evidenceTier": "consensus" },
  { "id": "consultants_reference_14", "parentType": "module", "parentId": "consultants_module_14_quality_assurance_audit_clinic_standards", "citation": "Clinic standards, audit, and quality assurance framework.", "sourceType": "consensus", "year": 2026, "url": "", "notes": "Operational quality reference.", "evidenceTier": "consensus" },
  { "id": "consultants_reference_15", "parentType": "module", "parentId": "consultants_module_15_final_competency_assessment", "citation": "Consultant academy capstone and award governance criteria.", "sourceType": "consensus", "year": 2026, "url": "", "notes": "Capstone moderation reference.", "evidenceTier": "consensus" }
]
